"No.","Time","Source","Destination","Protocol","Length","Info"
"1","2020-08-10 01:39:16.877926","192.168.38.104","192.168.38.105","TCP","54","63631  >  8412 [FIN, ACK] Seq=1 Ack=1 Win=8394 Len=0"
"2","2020-08-10 01:39:16.878306","192.168.38.105","192.168.38.104","TLSv1.2","78","Application Data"
"3","2020-08-10 01:39:16.878356","192.168.38.104","192.168.38.105","TCP","54","63631  >  8412 [RST, ACK] Seq=2 Ack=25 Win=0 Len=0"
"4","2020-08-10 01:39:16.878384","192.168.38.105","192.168.38.104","TCP","54","8412  >  63631 [FIN, ACK] Seq=25 Ack=2 Win=227 Len=0"
"5","2020-08-10 01:39:16.880962","192.168.38.104","192.168.38.105","TCP","66","63633  >  8412 [SYN] Seq=0 Win=62727 Len=0 MSS=8961 WS=256 SACK_PERM=1"
"6","2020-08-10 01:39:16.881274","192.168.38.105","192.168.38.104","TCP","66","8412  >  63633 [SYN, ACK] Seq=0 Ack=1 Win=26883 Len=0 MSS=8961 SACK_PERM=1 WS=128"
"7","2020-08-10 01:39:16.881329","192.168.38.104","192.168.38.105","TCP","54","63633  >  8412 [ACK] Seq=1 Ack=1 Win=2150400 Len=0"
"8","2020-08-10 01:39:16.882300","192.168.38.104","192.168.38.105","TLSv1.3","571","Client Hello"
"9","2020-08-10 01:39:16.882528","192.168.38.105","192.168.38.104","TCP","54","8412  >  63633 [ACK] Seq=1 Ack=518 Win=28032 Len=0"
"10","2020-08-10 01:39:16.885362","192.168.38.105","192.168.38.104","TLSv1.3","1420","Server Hello, Change Cipher Spec, Application Data, Application Data, Application Data, Application Data, Application Data"
"11","2020-08-10 01:39:16.886200","192.168.38.104","192.168.38.105","TLSv1.3","118","Change Cipher Spec, Application Data"
"12","2020-08-10 01:39:16.927304","192.168.38.105","192.168.38.104","TCP","54","8412  >  63633 [ACK] Seq=1367 Ack=582 Win=28032 Len=0"
"13","2020-08-10 01:39:16.927357","192.168.38.104","192.168.38.105","TLSv1.3","495","Application Data, Application Data, Application Data, Application Data, Application Data, Application Data, Application Data, Application Data, Application Data, Application Data"
"14","2020-08-10 01:39:16.927610","192.168.38.105","192.168.38.104","TCP","54","8412  >  63633 [ACK] Seq=1367 Ack=1023 Win=29056 Len=0"
"15","2020-08-10 01:39:16.931043","192.168.38.105","192.168.38.104","TLSv1.3","219","Application Data"
"16","2020-08-10 01:39:16.971230","192.168.38.104","192.168.38.105","TCP","54","63633  >  8412 [ACK] Seq=1023 Ack=1532 Win=2148864 Len=0"
"17","2020-08-10 01:39:18.020090","192.168.38.104","192.168.38.103","TCP","54","63570  >  5985 [FIN, ACK] Seq=1 Ack=1 Win=8212 Len=0"
"18","2020-08-10 01:39:18.020382","192.168.38.104","192.168.38.103","TCP","66","63634  >  5985 [SYN] Seq=0 Win=62727 Len=0 MSS=8961 WS=256 SACK_PERM=1"
"19","2020-08-10 01:39:18.020418","192.168.38.103","192.168.38.104","TCP","54","5985  >  63570 [FIN, ACK] Seq=1 Ack=2 Win=8212 Len=0"
"20","2020-08-10 01:39:18.020450","192.168.38.104","192.168.38.103","TCP","54","63570  >  5985 [ACK] Seq=2 Ack=2 Win=8212 Len=0"
"21","2020-08-10 01:39:18.020567","192.168.38.103","192.168.38.104","TCP","66","5985  >  63634 [SYN, ACK] Seq=0 Ack=1 Win=8192 Len=0 MSS=1460 WS=256 SACK_PERM=1"
"22","2020-08-10 01:39:18.020605","192.168.38.104","192.168.38.103","TCP","54","63634  >  5985 [ACK] Seq=1 Ack=1 Win=262656 Len=0"
"23","2020-08-10 01:39:18.020679","192.168.38.104","192.168.38.103","TCP","390","63634  >  5985 [PSH, ACK] Seq=1 Ack=1 Win=262656 Len=336 [TCP segment of a reassembled PDU]"
"24","2020-08-10 01:39:18.020715","192.168.38.104","192.168.38.103","HTTP","2556","POST /wsman/subscriptions/EB489718-F373-4F7F-8493-B0D1503B3C3E/43 HTTP/1.1 "
"25","2020-08-10 01:39:18.020874","192.168.38.103","192.168.38.104","TCP","54","5985  >  63634 [ACK] Seq=1 Ack=2839 Win=2102272 Len=0"
"26","2020-08-10 01:39:18.020934","192.168.38.103","192.168.38.104","HTTP","273","HTTP/1.1 401  "
"27","2020-08-10 01:39:18.020953","192.168.38.104","192.168.38.103","TCP","54","63634  >  5985 [ACK] Seq=2839 Ack=221 Win=262400 Len=0"
"28","2020-08-10 01:39:18.020976","192.168.38.104","192.168.38.103","TCP","54","63634  >  5985 [FIN, ACK] Seq=2839 Ack=221 Win=262400 Len=0"
"29","2020-08-10 01:39:18.021123","192.168.38.103","192.168.38.104","TCP","54","5985  >  63634 [ACK] Seq=221 Ack=2840 Win=2102272 Len=0"
"30","2020-08-10 01:39:18.021922","192.168.38.104","192.168.38.103","TCP","66","63635  >  5985 [SYN] Seq=0 Win=62727 Len=0 MSS=8961 WS=256 SACK_PERM=1"
"31","2020-08-10 01:39:18.022116","192.168.38.103","192.168.38.104","TCP","66","5985  >  63635 [SYN, ACK] Seq=0 Ack=1 Win=8192 Len=0 MSS=1460 WS=256 SACK_PERM=1"
"32","2020-08-10 01:39:18.022154","192.168.38.104","192.168.38.103","TCP","54","63635  >  5985 [ACK] Seq=1 Ack=1 Win=262656 Len=0"
"33","2020-08-10 01:39:18.022214","192.168.38.104","192.168.38.103","HTTP","2544","POST /wsman/subscriptions/EB489718-F373-4F7F-8493-B0D1503B3C3E/43 HTTP/1.1 "
"34","2020-08-10 01:39:18.022388","192.168.38.103","192.168.38.104","TCP","54","5985  >  63635 [ACK] Seq=1 Ack=2491 Win=2102272 Len=0"
"35","2020-08-10 01:39:18.023101","192.168.38.103","192.168.38.104","HTTP","395","HTTP/1.1 200  "
"36","2020-08-10 01:39:18.023714","192.168.38.104","192.168.38.103","TCP","390","63635  >  5985 [PSH, ACK] Seq=2491 Ack=342 Win=262400 Len=336 [TCP segment of a reassembled PDU]"
"37","2020-08-10 01:39:18.023746","192.168.38.104","192.168.38.103","HTTP","2556","POST /wsman/subscriptions/EB489718-F373-4F7F-8493-B0D1503B3C3E/43 HTTP/1.1 "
"38","2020-08-10 01:39:18.023934","192.168.38.103","192.168.38.104","TCP","54","5985  >  63635 [ACK] Seq=342 Ack=5329 Win=2102272 Len=0"
"39","2020-08-10 01:39:18.024554","192.168.38.103","192.168.38.104","TCP","1514","5985  >  63635 [ACK] Seq=342 Ack=5329 Win=2102272 Len=1460 [TCP segment of a reassembled PDU]"
"40","2020-08-10 01:39:18.024554","192.168.38.103","192.168.38.104","HTTP","553","HTTP/1.1 200   (application/http-kerberos-session-encrypted)"
"41","2020-08-10 01:39:18.024582","192.168.38.104","192.168.38.103","TCP","54","63635  >  5985 [ACK] Seq=5329 Ack=2301 Win=262656 Len=0"
"42","2020-08-10 01:39:18.025504","192.168.38.104","192.168.38.103","TCP","390","63635  >  5985 [PSH, ACK] Seq=5329 Ack=2301 Win=262656 Len=336 [TCP segment of a reassembled PDU]"
"43","2020-08-10 01:39:18.025561","192.168.38.104","192.168.38.103","HTTP","2552","POST /wsman/subscriptions/EB489718-F373-4F7F-8493-B0D1503B3C3E/43 HTTP/1.1 "
"44","2020-08-10 01:39:18.025730","192.168.38.103","192.168.38.104","TCP","54","5985  >  63635 [ACK] Seq=2301 Ack=8163 Win=2102272 Len=0"
"45","2020-08-10 01:39:18.026263","192.168.38.103","192.168.38.104","TCP","1514","5985  >  63635 [ACK] Seq=2301 Ack=8163 Win=2102272 Len=1460 [TCP segment of a reassembled PDU]"
"46","2020-08-10 01:39:18.026263","192.168.38.103","192.168.38.104","HTTP","553","HTTP/1.1 200   (application/http-kerberos-session-encrypted)"
"47","2020-08-10 01:39:18.026292","192.168.38.104","192.168.38.103","TCP","54","63635  >  5985 [ACK] Seq=8163 Ack=4260 Win=262656 Len=0"
"48","2020-08-10 01:39:18.319449","192.168.38.104","18.217.1.57","TCP","66","63636  >  80 [SYN] Seq=0 Win=62727 Len=0 MSS=8961 WS=256 SACK_PERM=1"
"49","2020-08-10 01:39:18.319679","192.168.38.104","18.217.1.57","TCP","66","63637  >  80 [SYN] Seq=0 Win=62727 Len=0 MSS=8961 WS=256 SACK_PERM=1"
"50","2020-08-10 01:39:18.368551","18.217.1.57","192.168.38.104","TCP","66","80  >  63636 [SYN, ACK] Seq=0 Ack=1 Win=62727 Len=0 MSS=1460 SACK_PERM=1 WS=128"
"51","2020-08-10 01:39:18.368624","192.168.38.104","18.217.1.57","TCP","54","63636  >  80 [ACK] Seq=1 Ack=1 Win=262656 Len=0"
"52","2020-08-10 01:39:18.368859","192.168.38.104","18.217.1.57","HTTP","499","GET / HTTP/1.1 "
"53","2020-08-10 01:39:18.369816","18.217.1.57","192.168.38.104","TCP","66","80  >  63637 [SYN, ACK] Seq=0 Ack=1 Win=62727 Len=0 MSS=1460 SACK_PERM=1 WS=128"
"54","2020-08-10 01:39:18.369851","192.168.38.104","18.217.1.57","TCP","54","63637  >  80 [ACK] Seq=1 Ack=1 Win=262656 Len=0"
"55","2020-08-10 01:39:18.417805","18.217.1.57","192.168.38.104","TCP","54","80  >  63636 [ACK] Seq=1 Ack=446 Win=62336 Len=0"
"56","2020-08-10 01:39:18.419277","18.217.1.57","192.168.38.104","TCP","71","80  >  63636 [PSH, ACK] Seq=1 Ack=446 Win=62336 Len=17 [TCP segment of a reassembled PDU]"
"57","2020-08-10 01:39:18.419393","18.217.1.57","192.168.38.104","HTTP","289","HTTP/1.0 200 OK  (text/html)"
"58","2020-08-10 01:39:18.419416","192.168.38.104","18.217.1.57","TCP","54","63636  >  80 [ACK] Seq=446 Ack=254 Win=262400 Len=0"
"59","2020-08-10 01:39:18.423284","192.168.38.104","18.217.1.57","TCP","54","63636  >  80 [FIN, ACK] Seq=446 Ack=254 Win=262400 Len=0"
"60","2020-08-10 01:39:18.472268","18.217.1.57","192.168.38.104","TCP","54","80  >  63636 [ACK] Seq=254 Ack=447 Win=62336 Len=0"
"61","2020-08-10 01:39:19.114009","192.168.38.104","192.168.38.103","TCP","390","63580  >  5985 [PSH, ACK] Seq=1 Ack=1 Win=8212 Len=336 [TCP segment of a reassembled PDU]"
"62","2020-08-10 01:39:19.114058","192.168.38.104","192.168.38.103","HTTP","7557","POST /wsman/subscriptions/EB489718-F373-4F7F-8493-B0D1503B3C3E/36 HTTP/1.1 "
"63","2020-08-10 01:39:19.114337","192.168.38.103","192.168.38.104","TCP","54","5985  >  63580 [ACK] Seq=1 Ack=7840 Win=8212 Len=0"
"64","2020-08-10 01:39:19.115424","192.168.38.103","192.168.38.104","TCP","1514","5985  >  63580 [ACK] Seq=1 Ack=7840 Win=8212 Len=1460 [TCP segment of a reassembled PDU]"
"65","2020-08-10 01:39:19.115424","192.168.38.103","192.168.38.104","HTTP","553","HTTP/1.1 200   (application/http-kerberos-session-encrypted)"
"66","2020-08-10 01:39:19.115457","192.168.38.104","192.168.38.103","TCP","54","63580  >  5985 [ACK] Seq=7840 Ack=1960 Win=8212 Len=0"
"67","2020-08-10 01:39:19.125383","192.168.38.104","192.168.38.103","TCP","390","63580  >  5985 [PSH, ACK] Seq=7840 Ack=1960 Win=8212 Len=336 [TCP segment of a reassembled PDU]"
"68","2020-08-10 01:39:19.125424","192.168.38.104","192.168.38.103","HTTP","7611","POST /wsman/subscriptions/EB489718-F373-4F7F-8493-B0D1503B3C3E/36 HTTP/1.1 "
"69","2020-08-10 01:39:19.125690","192.168.38.103","192.168.38.104","TCP","54","5985  >  63580 [ACK] Seq=1960 Ack=15733 Win=8212 Len=0"
"70","2020-08-10 01:39:19.126656","192.168.38.103","192.168.38.104","TCP","1514","5985  >  63580 [ACK] Seq=1960 Ack=15733 Win=8212 Len=1460 [TCP segment of a reassembled PDU]"
"71","2020-08-10 01:39:19.126656","192.168.38.103","192.168.38.104","HTTP","553","HTTP/1.1 200   (application/http-kerberos-session-encrypted)"
"72","2020-08-10 01:39:19.126683","192.168.38.104","192.168.38.103","TCP","54","63580  >  5985 [ACK] Seq=15733 Ack=3919 Win=8212 Len=0"
"73","2020-08-10 01:39:19.130156","192.168.38.104","192.168.38.103","TCP","390","63580  >  5985 [PSH, ACK] Seq=15733 Ack=3919 Win=8212 Len=336 [TCP segment of a reassembled PDU]"
"74","2020-08-10 01:39:19.130190","192.168.38.104","192.168.38.103","HTTP","7623","POST /wsman/subscriptions/EB489718-F373-4F7F-8493-B0D1503B3C3E/36 HTTP/1.1 "
"75","2020-08-10 01:39:19.130672","192.168.38.103","192.168.38.104","TCP","54","5985  >  63580 [ACK] Seq=3919 Ack=23638 Win=8212 Len=0"
"76","2020-08-10 01:39:19.138828","192.168.38.103","192.168.38.104","TCP","1514","5985  >  63580 [ACK] Seq=3919 Ack=23638 Win=8212 Len=1460 [TCP segment of a reassembled PDU]"
"77","2020-08-10 01:39:19.138828","192.168.38.103","192.168.38.104","HTTP","553","HTTP/1.1 200   (application/http-kerberos-session-encrypted)"
"78","2020-08-10 01:39:19.138869","192.168.38.104","192.168.38.103","TCP","54","63580  >  5985 [ACK] Seq=23638 Ack=5878 Win=8212 Len=0"
"79","2020-08-10 01:39:19.140095","192.168.38.104","192.168.38.103","TCP","390","63580  >  5985 [PSH, ACK] Seq=23638 Ack=5878 Win=8212 Len=336 [TCP segment of a reassembled PDU]"
"80","2020-08-10 01:39:19.140135","192.168.38.104","192.168.38.103","HTTP","7627","POST /wsman/subscriptions/EB489718-F373-4F7F-8493-B0D1503B3C3E/36 HTTP/1.1 "
"81","2020-08-10 01:39:19.140416","192.168.38.103","192.168.38.104","TCP","54","5985  >  63580 [ACK] Seq=5878 Ack=31547 Win=8212 Len=0"
"82","2020-08-10 01:39:19.142167","192.168.38.103","192.168.38.104","TCP","1514","5985  >  63580 [ACK] Seq=5878 Ack=31547 Win=8212 Len=1460 [TCP segment of a reassembled PDU]"
"83","2020-08-10 01:39:19.142167","192.168.38.103","192.168.38.104","HTTP","553","HTTP/1.1 200   (application/http-kerberos-session-encrypted)"
"84","2020-08-10 01:39:19.142190","192.168.38.104","192.168.38.103","TCP","54","63580  >  5985 [ACK] Seq=31547 Ack=7837 Win=8212 Len=0"
"85","2020-08-10 01:39:19.143380","192.168.38.104","192.168.38.103","TCP","390","63580  >  5985 [PSH, ACK] Seq=31547 Ack=7837 Win=8212 Len=336 [TCP segment of a reassembled PDU]"
"86","2020-08-10 01:39:19.143414","192.168.38.104","192.168.38.103","HTTP","7611","POST /wsman/subscriptions/EB489718-F373-4F7F-8493-B0D1503B3C3E/36 HTTP/1.1 "
"87","2020-08-10 01:39:19.143636","192.168.38.103","192.168.38.104","TCP","54","5985  >  63580 [ACK] Seq=7837 Ack=39440 Win=8212 Len=0"
"88","2020-08-10 01:39:19.148124","192.168.38.103","192.168.38.104","TCP","1514","5985  >  63580 [ACK] Seq=7837 Ack=39440 Win=8212 Len=1460 [TCP segment of a reassembled PDU]"
"89","2020-08-10 01:39:19.148124","192.168.38.103","192.168.38.104","HTTP","553","HTTP/1.1 200   (application/http-kerberos-session-encrypted)"
"90","2020-08-10 01:39:19.148158","192.168.38.104","192.168.38.103","TCP","54","63580  >  5985 [ACK] Seq=39440 Ack=9796 Win=8212 Len=0"
"91","2020-08-10 01:39:19.149325","192.168.38.104","192.168.38.103","TCP","390","63580  >  5985 [PSH, ACK] Seq=39440 Ack=9796 Win=8212 Len=336 [TCP segment of a reassembled PDU]"
"92","2020-08-10 01:39:19.149363","192.168.38.104","192.168.38.103","HTTP","7611","POST /wsman/subscriptions/EB489718-F373-4F7F-8493-B0D1503B3C3E/36 HTTP/1.1 "
"93","2020-08-10 01:39:19.151822","192.168.38.103","192.168.38.104","TCP","54","5985  >  63580 [ACK] Seq=9796 Ack=47333 Win=8212 Len=0"
"94","2020-08-10 01:39:19.153582","192.168.38.103","192.168.38.104","TCP","1514","5985  >  63580 [ACK] Seq=9796 Ack=47333 Win=8212 Len=1460 [TCP segment of a reassembled PDU]"
"95","2020-08-10 01:39:19.153582","192.168.38.103","192.168.38.104","HTTP","553","HTTP/1.1 200   (application/http-kerberos-session-encrypted)"
"96","2020-08-10 01:39:19.153608","192.168.38.104","192.168.38.103","TCP","54","63580  >  5985 [ACK] Seq=47333 Ack=11755 Win=8212 Len=0"
"97","2020-08-10 01:39:19.159955","192.168.38.104","192.168.38.103","TCP","390","63580  >  5985 [PSH, ACK] Seq=47333 Ack=11755 Win=8212 Len=336 [TCP segment of a reassembled PDU]"
"98","2020-08-10 01:39:19.159993","192.168.38.104","192.168.38.103","HTTP","7619","POST /wsman/subscriptions/EB489718-F373-4F7F-8493-B0D1503B3C3E/36 HTTP/1.1 "
"99","2020-08-10 01:39:19.160226","192.168.38.103","192.168.38.104","TCP","54","5985  >  63580 [ACK] Seq=11755 Ack=55234 Win=8212 Len=0"
"100","2020-08-10 01:39:19.161194","192.168.38.103","192.168.38.104","TCP","1514","5985  >  63580 [ACK] Seq=11755 Ack=55234 Win=8212 Len=1460 [TCP segment of a reassembled PDU]"
"101","2020-08-10 01:39:19.161194","192.168.38.103","192.168.38.104","HTTP","553","HTTP/1.1 200   (application/http-kerberos-session-encrypted)"
"102","2020-08-10 01:39:19.161224","192.168.38.104","192.168.38.103","TCP","54","63580  >  5985 [ACK] Seq=55234 Ack=13714 Win=8212 Len=0"
"103","2020-08-10 01:39:19.168011","192.168.38.104","192.168.38.103","TCP","390","63580  >  5985 [PSH, ACK] Seq=55234 Ack=13714 Win=8212 Len=336 [TCP segment of a reassembled PDU]"
"104","2020-08-10 01:39:19.168051","192.168.38.104","192.168.38.103","HTTP","7603","POST /wsman/subscriptions/EB489718-F373-4F7F-8493-B0D1503B3C3E/36 HTTP/1.1 "
"105","2020-08-10 01:39:19.168265","192.168.38.103","192.168.38.104","TCP","54","5985  >  63580 [ACK] Seq=13714 Ack=63119 Win=8212 Len=0"
"106","2020-08-10 01:39:19.172931","192.168.38.103","192.168.38.104","TCP","1514","5985  >  63580 [ACK] Seq=13714 Ack=63119 Win=8212 Len=1460 [TCP segment of a reassembled PDU]"
"107","2020-08-10 01:39:19.172931","192.168.38.103","192.168.38.104","HTTP","553","HTTP/1.1 200   (application/http-kerberos-session-encrypted)"
"108","2020-08-10 01:39:19.172973","192.168.38.104","192.168.38.103","TCP","54","63580  >  5985 [ACK] Seq=63119 Ack=15673 Win=8212 Len=0"
"109","2020-08-10 01:39:19.174297","192.168.38.104","192.168.38.103","TCP","390","63580  >  5985 [PSH, ACK] Seq=63119 Ack=15673 Win=8212 Len=336 [TCP segment of a reassembled PDU]"
"110","2020-08-10 01:39:19.174338","192.168.38.104","192.168.38.103","HTTP","7611","POST /wsman/subscriptions/EB489718-F373-4F7F-8493-B0D1503B3C3E/36 HTTP/1.1 "
"111","2020-08-10 01:39:19.174588","192.168.38.103","192.168.38.104","TCP","54","5985  >  63580 [ACK] Seq=15673 Ack=71012 Win=8212 Len=0"
"112","2020-08-10 01:39:19.176723","192.168.38.103","192.168.38.104","TCP","1514","5985  >  63580 [ACK] Seq=15673 Ack=71012 Win=8212 Len=1460 [TCP segment of a reassembled PDU]"
"113","2020-08-10 01:39:19.176723","192.168.38.103","192.168.38.104","HTTP","553","HTTP/1.1 200   (application/http-kerberos-session-encrypted)"
"114","2020-08-10 01:39:19.176800","192.168.38.104","192.168.38.103","TCP","54","63580  >  5985 [ACK] Seq=71012 Ack=17632 Win=8212 Len=0"
"115","2020-08-10 01:39:19.178301","192.168.38.104","192.168.38.103","TCP","390","63580  >  5985 [PSH, ACK] Seq=71012 Ack=17632 Win=8212 Len=336 [TCP segment of a reassembled PDU]"
"116","2020-08-10 01:39:19.178341","192.168.38.104","192.168.38.103","HTTP","7603","POST /wsman/subscriptions/EB489718-F373-4F7F-8493-B0D1503B3C3E/36 HTTP/1.1 "
"117","2020-08-10 01:39:19.179302","192.168.38.103","192.168.38.104","TCP","54","5985  >  63580 [ACK] Seq=17632 Ack=78897 Win=8212 Len=0"
"118","2020-08-10 01:39:19.180515","192.168.38.103","192.168.38.104","TCP","1514","5985  >  63580 [ACK] Seq=17632 Ack=78897 Win=8212 Len=1460 [TCP segment of a reassembled PDU]"
"119","2020-08-10 01:39:19.180515","192.168.38.103","192.168.38.104","HTTP","553","HTTP/1.1 200   (application/http-kerberos-session-encrypted)"
"120","2020-08-10 01:39:19.180544","192.168.38.104","192.168.38.103","TCP","54","63580  >  5985 [ACK] Seq=78897 Ack=19591 Win=8212 Len=0"
"121","2020-08-10 01:39:19.184206","192.168.38.104","192.168.38.103","TCP","390","63580  >  5985 [PSH, ACK] Seq=78897 Ack=19591 Win=8212 Len=336 [TCP segment of a reassembled PDU]"
"122","2020-08-10 01:39:19.184247","192.168.38.104","192.168.38.103","HTTP","7611","POST /wsman/subscriptions/EB489718-F373-4F7F-8493-B0D1503B3C3E/36 HTTP/1.1 "
"123","2020-08-10 01:39:19.184998","192.168.38.103","192.168.38.104","TCP","54","5985  >  63580 [ACK] Seq=19591 Ack=86790 Win=8212 Len=0"
"124","2020-08-10 01:39:19.185809","192.168.38.103","192.168.38.104","TCP","1514","5985  >  63580 [ACK] Seq=19591 Ack=86790 Win=8212 Len=1460 [TCP segment of a reassembled PDU]"
"125","2020-08-10 01:39:19.185809","192.168.38.103","192.168.38.104","HTTP","553","HTTP/1.1 200   (application/http-kerberos-session-encrypted)"
"126","2020-08-10 01:39:19.185839","192.168.38.104","192.168.38.103","TCP","54","63580  >  5985 [ACK] Seq=86790 Ack=21550 Win=8212 Len=0"
"127","2020-08-10 01:39:19.186999","192.168.38.104","192.168.38.103","TCP","390","63580  >  5985 [PSH, ACK] Seq=86790 Ack=21550 Win=8212 Len=336 [TCP segment of a reassembled PDU]"
"128","2020-08-10 01:39:19.187038","192.168.38.104","192.168.38.103","HTTP","7611","POST /wsman/subscriptions/EB489718-F373-4F7F-8493-B0D1503B3C3E/36 HTTP/1.1 "
"129","2020-08-10 01:39:19.187314","192.168.38.103","192.168.38.104","TCP","54","5985  >  63580 [ACK] Seq=21550 Ack=94683 Win=8212 Len=0"
"130","2020-08-10 01:39:19.188555","192.168.38.103","192.168.38.104","TCP","1514","5985  >  63580 [ACK] Seq=21550 Ack=94683 Win=8212 Len=1460 [TCP segment of a reassembled PDU]"
"131","2020-08-10 01:39:19.188555","192.168.38.103","192.168.38.104","HTTP","553","HTTP/1.1 200   (application/http-kerberos-session-encrypted)"
"132","2020-08-10 01:39:19.188585","192.168.38.104","192.168.38.103","TCP","54","63580  >  5985 [ACK] Seq=94683 Ack=23509 Win=8212 Len=0"
"133","2020-08-10 01:39:19.190217","192.168.38.104","192.168.38.103","TCP","390","63580  >  5985 [PSH, ACK] Seq=94683 Ack=23509 Win=8212 Len=336 [TCP segment of a reassembled PDU]"
"134","2020-08-10 01:39:19.190256","192.168.38.104","192.168.38.103","HTTP","7607","POST /wsman/subscriptions/EB489718-F373-4F7F-8493-B0D1503B3C3E/36 HTTP/1.1 "
"135","2020-08-10 01:39:19.192896","192.168.38.103","192.168.38.104","TCP","54","5985  >  63580 [ACK] Seq=23509 Ack=102572 Win=8212 Len=0"
"136","2020-08-10 01:39:19.194356","192.168.38.103","192.168.38.104","TCP","1514","5985  >  63580 [ACK] Seq=23509 Ack=102572 Win=8212 Len=1460 [TCP segment of a reassembled PDU]"
"137","2020-08-10 01:39:19.194356","192.168.38.103","192.168.38.104","HTTP","553","HTTP/1.1 200   (application/http-kerberos-session-encrypted)"
"138","2020-08-10 01:39:19.194383","192.168.38.104","192.168.38.103","TCP","54","63580  >  5985 [ACK] Seq=102572 Ack=25468 Win=8212 Len=0"
"139","2020-08-10 01:39:19.196474","192.168.38.104","192.168.38.103","TCP","390","63580  >  5985 [PSH, ACK] Seq=102572 Ack=25468 Win=8212 Len=336 [TCP segment of a reassembled PDU]"
"140","2020-08-10 01:39:19.196511","192.168.38.104","192.168.38.103","HTTP","7611","POST /wsman/subscriptions/EB489718-F373-4F7F-8493-B0D1503B3C3E/36 HTTP/1.1 "
"141","2020-08-10 01:39:19.196894","192.168.38.103","192.168.38.104","TCP","54","5985  >  63580 [ACK] Seq=25468 Ack=110465 Win=8212 Len=0"
"142","2020-08-10 01:39:19.198720","192.168.38.103","192.168.38.104","TCP","1514","5985  >  63580 [ACK] Seq=25468 Ack=110465 Win=8212 Len=1460 [TCP segment of a reassembled PDU]"
"143","2020-08-10 01:39:19.198720","192.168.38.103","192.168.38.104","HTTP","553","HTTP/1.1 200   (application/http-kerberos-session-encrypted)"
"144","2020-08-10 01:39:19.198744","192.168.38.104","192.168.38.103","TCP","54","63580  >  5985 [ACK] Seq=110465 Ack=27427 Win=8212 Len=0"
"145","2020-08-10 01:39:19.207180","192.168.38.104","192.168.38.103","TCP","390","63580  >  5985 [PSH, ACK] Seq=110465 Ack=27427 Win=8212 Len=336 [TCP segment of a reassembled PDU]"
"146","2020-08-10 01:39:19.207217","192.168.38.104","192.168.38.103","HTTP","7619","POST /wsman/subscriptions/EB489718-F373-4F7F-8493-B0D1503B3C3E/36 HTTP/1.1 "
"147","2020-08-10 01:39:19.208108","192.168.38.103","192.168.38.104","TCP","54","5985  >  63580 [ACK] Seq=27427 Ack=118366 Win=8212 Len=0"
"148","2020-08-10 01:39:19.211543","192.168.38.103","192.168.38.104","TCP","1514","5985  >  63580 [ACK] Seq=27427 Ack=118366 Win=8212 Len=1460 [TCP segment of a reassembled PDU]"
"149","2020-08-10 01:39:19.211543","192.168.38.103","192.168.38.104","HTTP","553","HTTP/1.1 200   (application/http-kerberos-session-encrypted)"
"150","2020-08-10 01:39:19.211575","192.168.38.104","192.168.38.103","TCP","54","63580  >  5985 [ACK] Seq=118366 Ack=29386 Win=8212 Len=0"
"151","2020-08-10 01:39:19.238862","192.168.38.104","192.168.38.103","TCP","390","63580  >  5985 [PSH, ACK] Seq=118366 Ack=29386 Win=8212 Len=336 [TCP segment of a reassembled PDU]"
"152","2020-08-10 01:39:19.238919","192.168.38.104","192.168.38.103","HTTP","7619","POST /wsman/subscriptions/EB489718-F373-4F7F-8493-B0D1503B3C3E/36 HTTP/1.1 "
"153","2020-08-10 01:39:19.239198","192.168.38.103","192.168.38.104","TCP","54","5985  >  63580 [ACK] Seq=29386 Ack=126267 Win=8212 Len=0"
"154","2020-08-10 01:39:19.240234","192.168.38.103","192.168.38.104","TCP","1514","5985  >  63580 [ACK] Seq=29386 Ack=126267 Win=8212 Len=1460 [TCP segment of a reassembled PDU]"
"155","2020-08-10 01:39:19.240234","192.168.38.103","192.168.38.104","HTTP","553","HTTP/1.1 200   (application/http-kerberos-session-encrypted)"
"156","2020-08-10 01:39:19.240262","192.168.38.104","192.168.38.103","TCP","54","63580  >  5985 [ACK] Seq=126267 Ack=31345 Win=8212 Len=0"
"157","2020-08-10 01:39:19.250128","192.168.38.104","192.168.38.103","TCP","390","63580  >  5985 [PSH, ACK] Seq=126267 Ack=31345 Win=8212 Len=336 [TCP segment of a reassembled PDU]"
"158","2020-08-10 01:39:19.250173","192.168.38.104","192.168.38.103","HTTP","7615","POST /wsman/subscriptions/EB489718-F373-4F7F-8493-B0D1503B3C3E/36 HTTP/1.1 "
"159","2020-08-10 01:39:19.252305","192.168.38.103","192.168.38.104","TCP","54","5985  >  63580 [ACK] Seq=31345 Ack=134164 Win=8212 Len=0"
"160","2020-08-10 01:39:19.254492","192.168.38.103","192.168.38.104","TCP","1514","5985  >  63580 [ACK] Seq=31345 Ack=134164 Win=8212 Len=1460 [TCP segment of a reassembled PDU]"
"161","2020-08-10 01:39:19.254492","192.168.38.103","192.168.38.104","HTTP","553","HTTP/1.1 200   (application/http-kerberos-session-encrypted)"
"162","2020-08-10 01:39:19.254521","192.168.38.104","192.168.38.103","TCP","54","63580  >  5985 [ACK] Seq=134164 Ack=33304 Win=8212 Len=0"
"163","2020-08-10 01:39:19.255713","192.168.38.104","192.168.38.103","TCP","390","63580  >  5985 [PSH, ACK] Seq=134164 Ack=33304 Win=8212 Len=336 [TCP segment of a reassembled PDU]"
"164","2020-08-10 01:39:19.255748","192.168.38.104","192.168.38.103","HTTP","7607","POST /wsman/subscriptions/EB489718-F373-4F7F-8493-B0D1503B3C3E/36 HTTP/1.1 "
"165","2020-08-10 01:39:19.258342","192.168.38.103","192.168.38.104","TCP","54","5985  >  63580 [ACK] Seq=33304 Ack=142053 Win=8212 Len=0"
"166","2020-08-10 01:39:19.261857","192.168.38.103","192.168.38.104","TCP","1514","5985  >  63580 [ACK] Seq=33304 Ack=142053 Win=8212 Len=1460 [TCP segment of a reassembled PDU]"
"167","2020-08-10 01:39:19.261857","192.168.38.103","192.168.38.104","HTTP","553","HTTP/1.1 200   (application/http-kerberos-session-encrypted)"
"168","2020-08-10 01:39:19.261885","192.168.38.104","192.168.38.103","TCP","54","63580  >  5985 [ACK] Seq=142053 Ack=35263 Win=8212 Len=0"
"169","2020-08-10 01:39:19.263705","192.168.38.104","192.168.38.103","TCP","390","63580  >  5985 [PSH, ACK] Seq=142053 Ack=35263 Win=8212 Len=336 [TCP segment of a reassembled PDU]"
"170","2020-08-10 01:39:19.263742","192.168.38.104","192.168.38.103","HTTP","7607","POST /wsman/subscriptions/EB489718-F373-4F7F-8493-B0D1503B3C3E/36 HTTP/1.1 "
"171","2020-08-10 01:39:19.266653","192.168.38.103","192.168.38.104","TCP","54","5985  >  63580 [ACK] Seq=35263 Ack=149942 Win=8212 Len=0"
"172","2020-08-10 01:39:19.268901","192.168.38.103","192.168.38.104","TCP","1514","5985  >  63580 [ACK] Seq=35263 Ack=149942 Win=8212 Len=1460 [TCP segment of a reassembled PDU]"
"173","2020-08-10 01:39:19.268901","192.168.38.103","192.168.38.104","HTTP","553","HTTP/1.1 200   (application/http-kerberos-session-encrypted)"
"174","2020-08-10 01:39:19.268935","192.168.38.104","192.168.38.103","TCP","54","63580  >  5985 [ACK] Seq=149942 Ack=37222 Win=8212 Len=0"
"175","2020-08-10 01:39:19.274699","192.168.38.104","216.58.194.196","TCP","66","63638  >  443 [SYN] Seq=0 Win=62727 Len=0 MSS=8961 WS=256 SACK_PERM=1"
"176","2020-08-10 01:39:19.275873","216.58.194.196","192.168.38.104","TCP","66","443  >  63638 [SYN, ACK] Seq=0 Ack=1 Win=65535 Len=0 MSS=1430 SACK_PERM=1 WS=256"
"177","2020-08-10 01:39:19.275914","192.168.38.104","216.58.194.196","TCP","54","63638  >  443 [ACK] Seq=1 Ack=1 Win=262912 Len=0"
"178","2020-08-10 01:39:19.276205","192.168.38.104","216.58.194.196","TLSv1.3","634","Client Hello"
"179","2020-08-10 01:39:19.277431","216.58.194.196","192.168.38.104","TCP","54","443  >  63638 [ACK] Seq=1 Ack=581 Win=66816 Len=0"
"180","2020-08-10 01:39:19.277735","216.58.194.196","192.168.38.104","TLSv1.3","266","Server Hello, Change Cipher Spec, Application Data"
"181","2020-08-10 01:39:19.279180","192.168.38.104","216.58.194.196","TLSv1.3","118","Change Cipher Spec, Application Data"
"182","2020-08-10 01:39:19.279417","192.168.38.104","216.58.194.196","TLSv1.3","146","Application Data"
"183","2020-08-10 01:39:19.279564","192.168.38.104","216.58.194.196","TLSv1.3","373","Application Data"
"184","2020-08-10 01:39:19.279946","192.168.38.104","192.168.38.103","TCP","390","63580  >  5985 [PSH, ACK] Seq=149942 Ack=37222 Win=8212 Len=336 [TCP segment of a reassembled PDU]"
"185","2020-08-10 01:39:19.279987","192.168.38.104","192.168.38.103","HTTP","7615","POST /wsman/subscriptions/EB489718-F373-4F7F-8493-B0D1503B3C3E/36 HTTP/1.1 "
"186","2020-08-10 01:39:19.280216","192.168.38.103","192.168.38.104","TCP","54","5985  >  63580 [ACK] Seq=37222 Ack=157839 Win=8212 Len=0"
"187","2020-08-10 01:39:19.280585","216.58.194.196","192.168.38.104","TCP","54","443  >  63638 [ACK] Seq=213 Ack=737 Win=66816 Len=0"
"188","2020-08-10 01:39:19.280617","216.58.194.196","192.168.38.104","TLSv1.3","634","Application Data, Application Data"
"189","2020-08-10 01:39:19.280650","216.58.194.196","192.168.38.104","TLSv1.3","85","Application Data"
"190","2020-08-10 01:39:19.280663","192.168.38.104","216.58.194.196","TCP","54","63638  >  443 [ACK] Seq=1056 Ack=824 Win=262144 Len=0"
"191","2020-08-10 01:39:19.280776","192.168.38.104","216.58.194.196","TLSv1.3","85","Application Data"
"192","2020-08-10 01:39:19.281071","192.168.38.103","192.168.38.104","TCP","1514","5985  >  63580 [ACK] Seq=37222 Ack=157839 Win=8212 Len=1460 [TCP segment of a reassembled PDU]"
"193","2020-08-10 01:39:19.281071","192.168.38.103","192.168.38.104","HTTP","553","HTTP/1.1 200   (application/http-kerberos-session-encrypted)"
"194","2020-08-10 01:39:19.281098","192.168.38.104","192.168.38.103","TCP","54","63580  >  5985 [ACK] Seq=157839 Ack=39181 Win=8212 Len=0"
"195","2020-08-10 01:39:19.281887","216.58.194.196","192.168.38.104","TCP","54","443  >  63638 [ACK] Seq=824 Ack=1087 Win=68096 Len=0"
"196","2020-08-10 01:39:19.288718","192.168.38.104","192.168.38.103","TCP","390","63580  >  5985 [PSH, ACK] Seq=157839 Ack=39181 Win=8212 Len=336 [TCP segment of a reassembled PDU]"
"197","2020-08-10 01:39:19.288758","192.168.38.104","192.168.38.103","HTTP","7615","POST /wsman/subscriptions/EB489718-F373-4F7F-8493-B0D1503B3C3E/36 HTTP/1.1 "
"198","2020-08-10 01:39:19.289037","192.168.38.103","192.168.38.104","TCP","54","5985  >  63580 [ACK] Seq=39181 Ack=165736 Win=8212 Len=0"
"199","2020-08-10 01:39:19.289901","192.168.38.103","192.168.38.104","TCP","1514","5985  >  63580 [ACK] Seq=39181 Ack=165736 Win=8212 Len=1460 [TCP segment of a reassembled PDU]"
"200","2020-08-10 01:39:19.289901","192.168.38.103","192.168.38.104","HTTP","553","HTTP/1.1 200   (application/http-kerberos-session-encrypted)"
"201","2020-08-10 01:39:19.289933","192.168.38.104","192.168.38.103","TCP","54","63580  >  5985 [ACK] Seq=165736 Ack=41140 Win=8212 Len=0"
"202","2020-08-10 01:39:19.291167","192.168.38.104","192.168.38.103","TCP","390","63580  >  5985 [PSH, ACK] Seq=165736 Ack=41140 Win=8212 Len=336 [TCP segment of a reassembled PDU]"
"203","2020-08-10 01:39:19.291208","192.168.38.104","192.168.38.103","HTTP","7607","POST /wsman/subscriptions/EB489718-F373-4F7F-8493-B0D1503B3C3E/36 HTTP/1.1 "
"204","2020-08-10 01:39:19.294217","192.168.38.103","192.168.38.104","TCP","54","5985  >  63580 [ACK] Seq=41140 Ack=173625 Win=8212 Len=0"
"205","2020-08-10 01:39:19.296659","192.168.38.103","192.168.38.104","TCP","1514","5985  >  63580 [ACK] Seq=41140 Ack=173625 Win=8212 Len=1460 [TCP segment of a reassembled PDU]"
"206","2020-08-10 01:39:19.296659","192.168.38.103","192.168.38.104","HTTP","553","HTTP/1.1 200   (application/http-kerberos-session-encrypted)"
"207","2020-08-10 01:39:19.296693","192.168.38.104","192.168.38.103","TCP","54","63580  >  5985 [ACK] Seq=173625 Ack=43099 Win=8212 Len=0"
"208","2020-08-10 01:39:19.299746","192.168.38.104","192.168.38.103","TCP","390","63580  >  5985 [PSH, ACK] Seq=173625 Ack=43099 Win=8212 Len=336 [TCP segment of a reassembled PDU]"
"209","2020-08-10 01:39:19.299786","192.168.38.104","192.168.38.103","HTTP","7611","POST /wsman/subscriptions/EB489718-F373-4F7F-8493-B0D1503B3C3E/36 HTTP/1.1 "
"210","2020-08-10 01:39:19.299990","192.168.38.103","192.168.38.104","TCP","54","5985  >  63580 [ACK] Seq=43099 Ack=181518 Win=8212 Len=0"
"211","2020-08-10 01:39:19.300668","192.168.38.103","192.168.38.104","TCP","1514","5985  >  63580 [ACK] Seq=43099 Ack=181518 Win=8212 Len=1460 [TCP segment of a reassembled PDU]"
"212","2020-08-10 01:39:19.300668","192.168.38.103","192.168.38.104","HTTP","553","HTTP/1.1 200   (application/http-kerberos-session-encrypted)"
"213","2020-08-10 01:39:19.300696","192.168.38.104","192.168.38.103","TCP","54","63580  >  5985 [ACK] Seq=181518 Ack=45058 Win=8212 Len=0"
"214","2020-08-10 01:39:19.301952","192.168.38.104","192.168.38.103","TCP","390","63580  >  5985 [PSH, ACK] Seq=181518 Ack=45058 Win=8212 Len=336 [TCP segment of a reassembled PDU]"
"215","2020-08-10 01:39:19.301990","192.168.38.104","192.168.38.103","HTTP","7619","POST /wsman/subscriptions/EB489718-F373-4F7F-8493-B0D1503B3C3E/36 HTTP/1.1 "
"216","2020-08-10 01:39:19.302577","192.168.38.103","192.168.38.104","TCP","54","5985  >  63580 [ACK] Seq=45058 Ack=189419 Win=8212 Len=0"
"217","2020-08-10 01:39:19.308635","192.168.38.103","192.168.38.104","TCP","1514","5985  >  63580 [ACK] Seq=45058 Ack=189419 Win=8212 Len=1460 [TCP segment of a reassembled PDU]"
"218","2020-08-10 01:39:19.308635","192.168.38.103","192.168.38.104","HTTP","553","HTTP/1.1 200   (application/http-kerberos-session-encrypted)"
"219","2020-08-10 01:39:19.308661","192.168.38.104","192.168.38.103","TCP","54","63580  >  5985 [ACK] Seq=189419 Ack=47017 Win=8212 Len=0"
"220","2020-08-10 01:39:19.310079","192.168.38.104","192.168.38.103","TCP","390","63580  >  5985 [PSH, ACK] Seq=189419 Ack=47017 Win=8212 Len=336 [TCP segment of a reassembled PDU]"
"221","2020-08-10 01:39:19.310112","192.168.38.104","192.168.38.103","HTTP","7619","POST /wsman/subscriptions/EB489718-F373-4F7F-8493-B0D1503B3C3E/36 HTTP/1.1 "
"222","2020-08-10 01:39:19.312103","192.168.38.103","192.168.38.104","TCP","54","5985  >  63580 [ACK] Seq=47017 Ack=197320 Win=8212 Len=0"
"223","2020-08-10 01:39:19.313176","192.168.38.103","192.168.38.104","TCP","1514","5985  >  63580 [ACK] Seq=47017 Ack=197320 Win=8212 Len=1460 [TCP segment of a reassembled PDU]"
"224","2020-08-10 01:39:19.313176","192.168.38.103","192.168.38.104","HTTP","553","HTTP/1.1 200   (application/http-kerberos-session-encrypted)"
"225","2020-08-10 01:39:19.313204","192.168.38.104","192.168.38.103","TCP","54","63580  >  5985 [ACK] Seq=197320 Ack=48976 Win=8212 Len=0"
"226","2020-08-10 01:39:19.319295","192.168.38.104","192.168.38.103","TCP","390","63580  >  5985 [PSH, ACK] Seq=197320 Ack=48976 Win=8212 Len=336 [TCP segment of a reassembled PDU]"
"227","2020-08-10 01:39:19.319336","192.168.38.104","192.168.38.103","HTTP","7615","POST /wsman/subscriptions/EB489718-F373-4F7F-8493-B0D1503B3C3E/36 HTTP/1.1 "
"228","2020-08-10 01:39:19.319547","192.168.38.103","192.168.38.104","TCP","54","5985  >  63580 [ACK] Seq=48976 Ack=205217 Win=8212 Len=0"
"229","2020-08-10 01:39:19.320547","216.58.194.196","192.168.38.104","TLSv1.3","421","Application Data"
"230","2020-08-10 01:39:19.320596","192.168.38.103","192.168.38.104","TCP","1514","5985  >  63580 [ACK] Seq=48976 Ack=205217 Win=8212 Len=1460 [TCP segment of a reassembled PDU]"
"231","2020-08-10 01:39:19.320596","192.168.38.103","192.168.38.104","HTTP","553","HTTP/1.1 200   (application/http-kerberos-session-encrypted)"
"232","2020-08-10 01:39:19.320596","216.58.194.196","192.168.38.104","TLSv1.3","179","Application Data"
"233","2020-08-10 01:39:19.320624","192.168.38.104","192.168.38.103","TCP","54","63580  >  5985 [ACK] Seq=205217 Ack=50935 Win=8212 Len=0"
"234","2020-08-10 01:39:19.320639","192.168.38.104","216.58.194.196","TCP","54","63638  >  443 [ACK] Seq=1087 Ack=1316 Win=261632 Len=0"
"235","2020-08-10 01:39:19.321001","216.58.194.196","192.168.38.104","TLSv1.3","86","Application Data"
"236","2020-08-10 01:39:19.321038","216.58.194.196","192.168.38.104","TLSv1.3","85","Application Data"
"237","2020-08-10 01:39:19.321050","192.168.38.104","216.58.194.196","TCP","54","63638  >  443 [ACK] Seq=1087 Ack=1379 Win=261632 Len=0"
"238","2020-08-10 01:39:19.321167","216.58.194.196","192.168.38.104","TLSv1.3","93","Application Data"
"239","2020-08-10 01:39:19.321418","192.168.38.104","216.58.194.196","TLSv1.3","93","Application Data"
"240","2020-08-10 01:39:19.327653","216.58.194.196","192.168.38.104","TCP","54","443  >  63638 [ACK] Seq=1418 Ack=1126 Win=68096 Len=0"
"241","2020-08-10 01:39:19.338362","192.168.38.104","192.168.38.103","TCP","390","63580  >  5985 [PSH, ACK] Seq=205217 Ack=50935 Win=8212 Len=336 [TCP segment of a reassembled PDU]"
"242","2020-08-10 01:39:19.338410","192.168.38.104","192.168.38.103","HTTP","7635","POST /wsman/subscriptions/EB489718-F373-4F7F-8493-B0D1503B3C3E/36 HTTP/1.1 "
"243","2020-08-10 01:39:19.341430","192.168.38.103","192.168.38.104","TCP","54","5985  >  63580 [ACK] Seq=50935 Ack=213134 Win=8212 Len=0"
"244","2020-08-10 01:39:19.345660","192.168.38.103","192.168.38.104","TCP","1514","5985  >  63580 [ACK] Seq=50935 Ack=213134 Win=8212 Len=1460 [TCP segment of a reassembled PDU]"
"245","2020-08-10 01:39:19.345660","192.168.38.103","192.168.38.104","HTTP","553","HTTP/1.1 200   (application/http-kerberos-session-encrypted)"
"246","2020-08-10 01:39:19.345697","192.168.38.104","192.168.38.103","TCP","54","63580  >  5985 [ACK] Seq=213134 Ack=52894 Win=8212 Len=0"
"247","2020-08-10 01:39:19.365684","192.168.38.104","192.168.38.103","TCP","390","63580  >  5985 [PSH, ACK] Seq=213134 Ack=52894 Win=8212 Len=336 [TCP segment of a reassembled PDU]"
"248","2020-08-10 01:39:19.365729","192.168.38.104","192.168.38.103","HTTP","7623","POST /wsman/subscriptions/EB489718-F373-4F7F-8493-B0D1503B3C3E/36 HTTP/1.1 "
"249","2020-08-10 01:39:19.365999","192.168.38.103","192.168.38.104","TCP","54","5985  >  63580 [ACK] Seq=52894 Ack=221039 Win=8212 Len=0"
"250","2020-08-10 01:39:19.368730","192.168.38.103","192.168.38.104","TCP","1514","5985  >  63580 [ACK] Seq=52894 Ack=221039 Win=8212 Len=1460 [TCP segment of a reassembled PDU]"
"251","2020-08-10 01:39:19.368730","192.168.38.103","192.168.38.104","HTTP","553","HTTP/1.1 200   (application/http-kerberos-session-encrypted)"
"252","2020-08-10 01:39:19.368758","192.168.38.104","192.168.38.103","TCP","54","63580  >  5985 [ACK] Seq=221039 Ack=54853 Win=8212 Len=0"
"253","2020-08-10 01:39:19.380823","192.168.38.104","192.168.38.103","TCP","390","63580  >  5985 [PSH, ACK] Seq=221039 Ack=54853 Win=8212 Len=336 [TCP segment of a reassembled PDU]"
"254","2020-08-10 01:39:19.380872","192.168.38.104","192.168.38.103","HTTP","7623","POST /wsman/subscriptions/EB489718-F373-4F7F-8493-B0D1503B3C3E/36 HTTP/1.1 "
"255","2020-08-10 01:39:19.381164","192.168.38.103","192.168.38.104","TCP","54","5985  >  63580 [ACK] Seq=54853 Ack=228944 Win=8212 Len=0"
"256","2020-08-10 01:39:19.381880","192.168.38.103","192.168.38.104","TCP","1514","5985  >  63580 [ACK] Seq=54853 Ack=228944 Win=8212 Len=1460 [TCP segment of a reassembled PDU]"
"257","2020-08-10 01:39:19.381880","192.168.38.103","192.168.38.104","HTTP","553","HTTP/1.1 200   (application/http-kerberos-session-encrypted)"
"258","2020-08-10 01:39:19.381911","192.168.38.104","192.168.38.103","TCP","54","63580  >  5985 [ACK] Seq=228944 Ack=56812 Win=8212 Len=0"
"259","2020-08-10 01:39:19.394778","192.168.38.104","192.168.38.103","TCP","390","63580  >  5985 [PSH, ACK] Seq=228944 Ack=56812 Win=8212 Len=336 [TCP segment of a reassembled PDU]"
"260","2020-08-10 01:39:19.394826","192.168.38.104","192.168.38.103","HTTP","7623","POST /wsman/subscriptions/EB489718-F373-4F7F-8493-B0D1503B3C3E/36 HTTP/1.1 "
"261","2020-08-10 01:39:19.395048","192.168.38.103","192.168.38.104","TCP","54","5985  >  63580 [ACK] Seq=56812 Ack=236849 Win=8212 Len=0"
"262","2020-08-10 01:39:19.395890","192.168.38.103","192.168.38.104","TCP","1514","5985  >  63580 [ACK] Seq=56812 Ack=236849 Win=8212 Len=1460 [TCP segment of a reassembled PDU]"
"263","2020-08-10 01:39:19.395890","192.168.38.103","192.168.38.104","HTTP","553","HTTP/1.1 200   (application/http-kerberos-session-encrypted)"
